{
  "$schema": "https://json-schema.org/draft/2020-12/schema",
  "title": "SCZN3 Target Knowledge Manifest",
  "type": "object",
  "additionalProperties": false,
  "required": [
    "schemaVersion",
    "targetIdentity",
    "authorityClassification",
    "instructionAuthority",
    "geometryAuthority",
    "evidenceRequirements",
    "unknowns",
    "sourceAudit"
  ],
  "properties": {
    "schemaVersion": {
      "type": "string"
    },
    "targetIdentity": {
      "type": "object",
      "additionalProperties": false,
      "required": [
        "targetId",
        "targetName",
        "targetFamily",
        "targetType",
        "discipline",
        "guidanceMode"
      ],
      "properties": {
        "targetId": { "type": "string" },
        "targetName": { "type": "string" },
        "targetFamily": { "type": "string" },
        "targetType": { "type": "string" },
        "discipline": { "type": "string" },
        "manufacturer": { "type": "string" },
        "sku": { "type": "string" },
        "missionFamilyId": { "type": "string" },
        "missionGroup": { "type": "string" },
        "missionName": { "type": "string" },
        "missionVariant": { "type": "string" },
        "targetDisplayName": { "type": "string" },
        "lifecycleStatus": { "enum": ["research", "draft", "validation", "supported", "retired"] },
        "supportedStatus": { "enum": ["unavailable", "supported", "retired"] },
        "recommendedFirearmType": { "type": "string" },
        "resultPackageType": { "type": "string" },
        "secTemplate": { "type": "string" },
        "stageCount": { "type": "integer" },
        "totalRounds": { "type": "integer" },
        "maxScore": { "type": "integer" },
        "stageDefinitions": { "type": "array" },
        "guidanceMode": { "type": "string" }
      }
    },
    "uteRouting": {
      "type": "object",
      "additionalProperties": false,
      "properties": {
        "targetId": { "type": "string" },
        "manufacturer": { "type": "string" },
        "sku": { "type": "string" },
        "missionFamilyId": { "type": "string" },
        "missionGroup": { "type": "string" },
        "missionName": { "type": "string" },
        "missionVariant": { "type": "string" },
        "targetDisplayName": { "type": "string" },
        "lifecycleStatus": { "enum": ["research", "draft", "validation", "supported", "retired"] },
        "supportedStatus": { "enum": ["unavailable", "supported", "retired"] },
        "geometryAuthorityStatus": { "type": "string" },
        "scoringAuthorityStatus": { "type": "string" },
        "recommendedFirearmType": { "type": "string" },
        "resultPackageType": { "type": "string" },
        "secTemplate": { "type": "string" },
        "stageCount": { "type": "integer" },
        "totalRounds": { "type": "integer" },
        "maxScore": { "type": "integer" },
        "stageDefinitions": { "type": "array" },
        "authorityStatus": { "type": "string" },
        "rulesSource": { "type": "string" },
        "geometryStatus": { "type": "string" },
        "instructionStatus": { "type": "string" },
        "scoringStatus": { "type": "string" },
        "qualificationStatus": { "type": "string" },
        "evidenceModel": { "type": "string" }
      }
    },
    "executionComposition": {
      "type": "object",
      "additionalProperties": false,
      "required": [
        "targetProfileRef",
        "geometryComponentRef",
        "registrationComponentRef",
        "scoringComponentRef",
        "missionComponentRef",
        "executionContractRef"
      ],
      "properties": {
        "targetProfileRef": { "$ref": "#/$defs/versionedReference" },
        "geometryComponentRef": { "$ref": "#/$defs/versionedReference" },
        "registrationComponentRef": { "$ref": "#/$defs/versionedReference" },
        "scoringComponentRef": { "$ref": "#/$defs/versionedReference" },
        "missionComponentRef": { "$ref": "#/$defs/versionedReference" },
        "executionContractRef": { "$ref": "#/$defs/versionedReference" }
      }
    },
    "authorityClassification": {
      "type": "object",
      "additionalProperties": false,
      "required": [
        "primaryAuthorityType",
        "geometryAuthorityLevel",
        "instructionAuthorityLevel",
        "sourceConfidence"
      ],
      "properties": {
        "primaryAuthorityType": { "type": "string" },
        "geometryAuthorityLevel": { "type": "string" },
        "instructionAuthorityLevel": { "type": "string" },
        "sourceConfidence": { "type": "string" }
      }
    },
    "instructionAuthority": {
      "type": "object",
      "additionalProperties": false,
      "required": [
        "designerInstructions",
        "printedTargetText",
        "officialRules",
        "courseOfFire",
        "intendedUse",
        "shotCount",
        "distance",
        "passFailOrScoringRules"
      ],
      "properties": {
        "designerInstructions": { "type": "array" },
        "printedTargetText": { "type": "array" },
        "officialRules": { "type": "array" },
        "courseOfFire": { "type": "array" },
        "intendedUse": { "type": "string" },
        "shotCount": {},
        "distance": {},
        "passFailOrScoringRules": { "type": "array" }
      }
    },
    "geometryAuthority": {
      "type": "object",
      "additionalProperties": false,
      "required": [
        "knownGeometryFields",
        "gridSpacing",
        "bullCount",
        "zoneCount",
        "aimPointRules",
        "scoringZones",
        "ringGeometry"
      ],
      "properties": {
        "knownGeometryFields": { "type": "object" },
        "gridSpacing": {},
        "bullCount": {},
        "zoneCount": {},
        "aimPointRules": { "type": "array" },
        "scoringZones": { "type": "array" },
        "ringGeometry": {}
      }
    },
    "evidenceRequirements": {
      "type": "object",
      "additionalProperties": false,
      "required": [
        "requiredAimPoint",
        "requiredImpactCount",
        "requiredDistance",
        "requiredSetupFields",
        "minimumConfidenceRequirements"
      ],
      "properties": {
        "requiredAimPoint": {},
        "requiredImpactCount": {},
        "requiredDistance": {},
        "requiredSetupFields": { "type": "array" },
        "minimumConfidenceRequirements": { "type": "array" }
      }
    },
    "unknowns": {
      "type": "array",
      "items": {
        "type": "object",
        "additionalProperties": false,
        "required": ["field", "status", "neededSource"],
        "properties": {
          "field": { "type": "string" },
          "status": { "const": "UNKNOWN / REQUIRES OFFICIAL SOURCE" },
          "neededSource": { "type": "string" }
        }
      }
    },
    "sourceAudit": {
      "type": "array",
      "items": {
        "type": "object",
        "additionalProperties": false,
        "required": ["sourceType", "source", "authorityType", "notes"],
        "properties": {
          "sourceType": { "type": "string" },
          "source": { "type": "string" },
          "authorityType": { "type": "string" },
          "notes": { "type": "string" }
        }
      }
    }
  },
  "$defs": {
    "versionedReference": {
      "type": "object",
      "additionalProperties": false,
      "required": ["id", "version"],
      "properties": {
        "id": { "type": "string", "minLength": 1 },
        "version": { "type": "string", "minLength": 1 }
      }
    }
  }
}
